productType,variantId,sku,prices,tax,categories,description.en-US,images,name.en-US,slug.en-US,metaTitle.en-US,metaDescription.en-US,metaKeywords.en-US,designer,material,arrangement
main,1,2,USD 13999,standard,armchairs,"Whether you're curling up with a good book, hosting intimate gatherings, or simply seeking a stylish accent piece, this modern wooden armchair is the perfect choice. Its timeless design and exceptional craftsmanship will add a touch of elegance and sophistication to any room.",https://images.cdn.europe-west1.gcp.commercetools.com/ff91879f-f4a7-436e-bc45-97970b384e8e/photo_2024-05-24_15--f1xxSEfO.jpg; https://images.cdn.europe-west1.gcp.commercetools.com/ff91879f-f4a7-436e-bc45-97970b384e8e/photo_2024-05-24_20--NCxPtpKL.jpg;https://images.cdn.europe-west1.gcp.commercetools.com/ff91879f-f4a7-436e-bc45-97970b384e8e/photo_2024-05-24_20--q_Bc97UA.jpg;,Loman,loman,loman,"Whether you're curling up with a good book, hosting intimate gatherings, or simply seeking a stylish accent piece, this modern wooden armchair is the perfect choice. Its timeless design and exceptional craftsmanship will add a touch of elegance and sophistication to any room.",basic,Fangorn Planks,wooden,house
main,1,3,USD 3999,standard,armchairs,The sleek and modern design of this chair makes it a great choice for any contemporary space.,https://images.cdn.europe-west1.gcp.commercetools.com/ff91879f-f4a7-436e-bc45-97970b384e8e/photo_2024-05-24_20--AfR_sEuv.jpg; https://images.cdn.europe-west1.gcp.commercetools.com/ff91879f-f4a7-436e-bc45-97970b384e8e/photo_2024-05-24_20--JaKro8-u.jpg;https://images.cdn.europe-west1.gcp.commercetools.com/ff91879f-f4a7-436e-bc45-97970b384e8e/photo_2024-05-24_20--mboSzfF5.jpg;,Hukol,hukol,hukol,The sleek and modern design of this chair makes it a great choice for any contemporary space,basic;,Mordor Forges,metal,house
main,1,4,USD 12099,standard,armchairs,"This metal armchair is a versatile piece that seamlessly blends style and functionality, making it an ideal addition to any contemporary space.",https://images.cdn.europe-west1.gcp.commercetools.com/ff91879f-f4a7-436e-bc45-97970b384e8e/photo_2024-05-24_20--8bVtyZpX.jpg;https://images.cdn.europe-west1.gcp.commercetools.com/ff91879f-f4a7-436e-bc45-97970b384e8e/photo_2024-05-24_20--nJqYnVsT.jpg;https://images.cdn.europe-west1.gcp.commercetools.com/ff91879f-f4a7-436e-bc45-97970b384e8e/photo_2024-05-24_20--UfyprpRz.jpg;,Jolko,jolko,jolko,"This metal armchair is a versatile piece that seamlessly blends style and functionality, making it an ideal addition to any contemporary space.",basic;,Mordor Forges,metal,house
main,1,5,USD 35999,standard,tables,"The tabletop, a canvas for modern design, can be fashioned from a variety of materials, from sleek, polished stone to warm, weathered wood. The interplay of these materials creates a unique visual and tactile experience, highlighting the table's contemporary aesthetic.",https://images.cdn.europe-west1.gcp.commercetools.com/ff91879f-f4a7-436e-bc45-97970b384e8e/photo_2024-05-24_19--1CSFTBRj.jpg;https://images.cdn.europe-west1.gcp.commercetools.com/ff91879f-f4a7-436e-bc45-97970b384e8e/photo_2024-05-24_19--lzW2DmOw.jpg;https://images.cdn.europe-west1.gcp.commercetools.com/ff91879f-f4a7-436e-bc45-97970b384e8e/photo_2024-05-24_19--bTBjeUd1.jpg;,Aspen coffee table,aspen-coffee-table,Aspen coffee table,"The tabletop, a canvas for modern design, can be fashioned from a variety of materials, from sleek, polished stone to warm, weathered wood. The interplay of these materials creates a unique visual and tactile experience, highlighting the table's contemporary aesthetic.",basic;,Mordor Forges,metal,house
main,1,6,USD 25999,standard,tables,"A modern metal table is a testament to sleek lines and minimalist design. Its frame, crafted from sturdy steel or aluminum, often boasts a powder-coated finish, offering a durable and vibrant palette of colors.",https://images.cdn.europe-west1.gcp.commercetools.com/ff91879f-f4a7-436e-bc45-97970b384e8e/photo_2024-05-24_19--EkuxZPEy.jpg;https://images.cdn.europe-west1.gcp.commercetools.com/ff91879f-f4a7-436e-bc45-97970b384e8e/photo_2024-05-24_19--QCU0yP56.jpg;https://images.cdn.europe-west1.gcp.commercetools.com/ff91879f-f4a7-436e-bc45-97970b384e8e/photo_2024-05-24_19--bpBYjODs.jpg;,Modern bug,modern-bug,Modern bug,"A modern metal table is a testament to sleek lines and minimalist design. Its frame, crafted from sturdy steel or aluminum, often boasts a powder-coated finish, offering a durable and vibrant palette of colors.",basic;,Mordor Forges,metal,house
main,1,7,USD 7890,standard,tables,"Modern plastic tables come in a wide range of shapes, sizes, and colors, allowing you to choose the perfect table to complement your décor and space requirements. From minimalist rectangular tables to round tables with intricate patterns, there's a plastic table to suit every taste and style. Whether you're looking for a dining table, a coffee table, or a side table, modern plastic tables offer a combination of durability, style, and functionality that is unmatched by other materials.",https://images.cdn.europe-west1.gcp.commercetools.com/ff91879f-f4a7-436e-bc45-97970b384e8e/photo_2024-05-24_19--xF2uoTiY.jpg;https://images.cdn.europe-west1.gcp.commercetools.com/ff91879f-f4a7-436e-bc45-97970b384e8e/photo_2024-05-24_19--7PboMUBH.jpg;https://images.cdn.europe-west1.gcp.commercetools.com/ff91879f-f4a7-436e-bc45-97970b384e8e/photo_2024-05-24_19--gMQR4MoX.jpg;,Solar eclipse table,table-solar-eclipse,Solar eclipse table,"Modern plastic tables come in a wide range of shapes, sizes, and colors, allowing you to choose the perfect table to complement your décor and space requirements. From minimalist rectangular tables to round tables with intricate patterns, there's a plastic table to suit every taste and style. Whether you're looking for a dining table, a coffee table, or a side table, modern plastic tables offer a combination of durability, style, and functionality that is unmatched by other materials.",basic;,Orthanc tower plastics,plastic,house
main,1,8,USD 95900,standard,tables,"Whether it's a sturdy dining table with a generous expanse for family gatherings, a compact coffee table perfect for intimate conversations, or a sleek desk designed for productivity, the modern wooden table offers a versatile and enduring presence. Its sturdy construction and minimalist design ensure a lasting impression, while its natural beauty and inherent warmth create a welcoming and inviting atmosphere.",https://images.cdn.europe-west1.gcp.commercetools.com/ff91879f-f4a7-436e-bc45-97970b384e8e/photo_2024-05-21_15--hJ5ECOE6.jpg;https://images.cdn.europe-west1.gcp.commercetools.com/ff91879f-f4a7-436e-bc45-97970b384e8e/photo_2024-05-24_19--Z4_-w6es.jpg;https://images.cdn.europe-west1.gcp.commercetools.com/ff91879f-f4a7-436e-bc45-97970b384e8e/photo_2024-05-24_19--bV7tW5qL.jpg;,Wooden ash table,table-wooden-ash,Wooden ash table,"Whether it's a sturdy dining table with a generous expanse for family gatherings, a compact coffee table perfect for intimate conversations, or a sleek desk designed for productivity, the modern wooden table offers a versatile and enduring presence. Its sturdy construction and minimalist design ensure a lasting impression, while its natural beauty and inherent warmth create a welcoming and inviting atmosphere.",basic;,Fangorn Planks,wooden,house
main,1,9,USD 15999,standard,tables,"Its clean lines and uncluttered silhouette complement a wide range of interior styles, from industrial chic to minimalist contemporary. Whether gracing a living room, dining area, or workspace, a modern metal table adds a touch of sophistication and functionality, making it a timeless piece that seamlessly blends form and function.",https://images.cdn.europe-west1.gcp.commercetools.com/ff91879f-f4a7-436e-bc45-97970b384e8e/photo_2024-05-24_19--DAfpicaw.jpg;https://images.cdn.europe-west1.gcp.commercetools.com/ff91879f-f4a7-436e-bc45-97970b384e8e/photo_2024-05-24_19--zYpasRT0.jpg;https://images.cdn.europe-west1.gcp.commercetools.com/ff91879f-f4a7-436e-bc45-97970b384e8e/photo_2024-05-24_19--X1xf38QR.jpg;,Glory sky table,table-glory-sky,Glory sky table,"Its clean lines and uncluttered silhouette complement a wide range of interior styles, from industrial chic to minimalist contemporary. Whether gracing a living room, dining area, or workspace, a modern metal table adds a touch of sophistication and functionality, making it a timeless piece that seamlessly blends form and function.",basic;,Mordor Forges,metal,house
main,1,10,USD 85900,standard,tables,"Crafted from sustainably sourced hardwoods, the table's rich grain patterns and warm hues create a natural focal point, adding a touch of organic beauty to the room. The smooth, lacquered finish not only protects the wood but also enhances its natural brilliance, reflecting light and adding a subtle sheen.",https://images.cdn.europe-west1.gcp.commercetools.com/ff91879f-f4a7-436e-bc45-97970b384e8e/photo_2024-05-21_15--GmrBkFjL.jpg;https://images.cdn.europe-west1.gcp.commercetools.com/ff91879f-f4a7-436e-bc45-97970b384e8e/photo_2024-05-24_19--YHOZncLn.jpg;https://images.cdn.europe-west1.gcp.commercetools.com/ff91879f-f4a7-436e-bc45-97970b384e8e/photo_2024-05-24_19--BQ9uNzhm.jpg;,Espresso coffee table,table-espresso-coffee,Espresso coffee table,"Crafted from sustainably sourced hardwoods, the table's rich grain patterns and warm hues create a natural focal point, adding a touch of organic beauty to the room. The smooth, lacquered finish not only protects the wood but also enhances its natural brilliance, reflecting light and adding a subtle sheen.",basic;,Fangorn Planks,wooden,house
main,1,11,USD 75900,standard,tables,"The modern wooden table, a testament to both timeless elegance and contemporary design, stands as a centerpiece in any living space. Its sleek lines and minimalist form exude a sense of understated sophistication, seamlessly blending with a multitude of interior styles.",https://images.cdn.europe-west1.gcp.commercetools.com/ff91879f-f4a7-436e-bc45-97970b384e8e/photo_2024-05-24_19--t5UJcz4i.jpg;https://images.cdn.europe-west1.gcp.commercetools.com/ff91879f-f4a7-436e-bc45-97970b384e8e/photo_2024-05-24_19--pGZd2-CU.jpg;https://images.cdn.europe-west1.gcp.commercetools.com/ff91879f-f4a7-436e-bc45-97970b384e8e/photo_2024-05-24_19--TmlzuG_s.jpg;,The ancient tavern table,table-ancient-tavern,The ancient tavern table,"The modern wooden table, a testament to both timeless elegance and contemporary design, stands as a centerpiece in any living space. Its sleek lines and minimalist form exude a sense of understated sophistication, seamlessly blending with a multitude of interior styles.",basic;,Fangorn Planks,wooden,house
main,1,12,USD 39500,standard,tables,"Made from durable and lightweight materials, these tables are designed to withstand the rigors of everyday use while providing a sleek and contemporary aesthetic. Their smooth, non-porous surfaces are easy to clean and maintain, making them ideal for busy households or workplaces.",https://images.cdn.europe-west1.gcp.commercetools.com/ff91879f-f4a7-436e-bc45-97970b384e8e/photo_2024-05-24_19--3R91K1LV.jpg;https://images.cdn.europe-west1.gcp.commercetools.com/ff91879f-f4a7-436e-bc45-97970b384e8e/photo_2024-05-24_19--G7Xy_PBh.jpg;https://images.cdn.europe-west1.gcp.commercetools.com/ff91879f-f4a7-436e-bc45-97970b384e8e/photo_2024-05-24_19--sFnXetIQ.jpg;,Black soul table,table-black-soul,Black soul table,"Made from durable and lightweight materials, these tables are designed to withstand the rigors of everyday use while providing a sleek and contemporary aesthetic. Their smooth, non-porous surfaces are easy to clean and maintain, making them ideal for busy households or workplaces.",basic;,Orthanc tower plastics,plastic,house
main,1,13,USD 27800,standard,tables,"Modern plastic tables are a versatile and stylish addition to any home or office. Made from durable and lightweight materials, these tables are designed to withstand the rigors of everyday use while providing a sleek and contemporary aesthetic.",https://images.cdn.europe-west1.gcp.commercetools.com/ff91879f-f4a7-436e-bc45-97970b384e8e/photo_2024-05-24_19--XqJ_wNFG.jpg;https://images.cdn.europe-west1.gcp.commercetools.com/ff91879f-f4a7-436e-bc45-97970b384e8e/photo_2024-05-24_19--BWFSbJGO.jpg;https://images.cdn.europe-west1.gcp.commercetools.com/ff91879f-f4a7-436e-bc45-97970b384e8e/photo_2024-05-24_19--aYMgi38V.jpg;,Blumarin table,table-blumarin,Blumarin table,"Modern plastic tables are a versatile and stylish addition to any home or office. Made from durable and lightweight materials, these tables are designed to withstand the rigors of everyday use while providing a sleek and contemporary aesthetic.",basic;,Orthanc tower plastics,plastic,house
main,1,14,USD 10999,standard,armchairs,"Made from durable and easy-to-clean plastic, this chair is perfect for everyday use",https://images.cdn.europe-west1.gcp.commercetools.com/ff91879f-f4a7-436e-bc45-97970b384e8e/photo_2024-05-24_15--_kAzHqLE.jpg;https://images.cdn.europe-west1.gcp.commercetools.com/ff91879f-f4a7-436e-bc45-97970b384e8e/photo_2024-05-24_15--dw727tNE.jpg;https://images.cdn.europe-west1.gcp.commercetools.com/ff91879f-f4a7-436e-bc45-97970b384e8e/photo_2024-05-24_15--AMjsaZE2.jpg;,Folke,armchair-folke,Folke,"Made from durable and easy-to-clean plastic, this chair is perfect for everyday use",basic;,Orthanc tower plastics,plastic,house
main,1,15,USD 2999,standard,armchairs,This modern plastic armchair is a stylish and comfortable addition to any home or office.,https://images.cdn.europe-west1.gcp.commercetools.com/ff91879f-f4a7-436e-bc45-97970b384e8e/photo_2024-05-24_15--O2RsPqbd.jpg;https://images.cdn.europe-west1.gcp.commercetools.com/ff91879f-f4a7-436e-bc45-97970b384e8e/photo_2024-05-24_15--s2iACOSA.jpg;https://images.cdn.europe-west1.gcp.commercetools.com/ff91879f-f4a7-436e-bc45-97970b384e8e/photo_2024-05-24_15--3J8fAvM8.jpg;,Foty,armchair-foty,Foty,This modern plastic armchair is a stylish and comfortable addition to any home or office.,basic;,Orthanc tower plastics,plastic,house
main,1,16,USD 11999,standard,chairs,"Introducing the epitome of modern sophistication, our stunning wooden armchair. Crafted from the finest solid wood, this chair exudes a timeless elegance that complements any contemporary living space.",https://images.cdn.europe-west1.gcp.commercetools.com/ff91879f-f4a7-436e-bc45-97970b384e8e/photo_2024-05-24_15--zY6GZZ7D.jpg;https://images.cdn.europe-west1.gcp.commercetools.com/ff91879f-f4a7-436e-bc45-97970b384e8e/photo_2024-05-24_16--vM_aByGs.jpg;https://images.cdn.europe-west1.gcp.commercetools.com/ff91879f-f4a7-436e-bc45-97970b384e8e/photo_2024-05-24_16--XBvy2GD2.jpg;,Dorka,armchair-dorka,Dorka,"Introducing the epitome of modern sophistication, our stunning wooden armchair. Crafted from the finest solid wood, this chair exudes a timeless elegance that complements any contemporary living space.",basic;,Fangorn Planks,wooden,house
main,1,17,USD 9999,standard,chairs,"The ergonomic design provides ample support for your back and neck, while the contoured seat ensures a comfortable sitting experience.",https://images.cdn.europe-west1.gcp.commercetools.com/ff91879f-f4a7-436e-bc45-97970b384e8e/photo_2024-05-24_15--r-Q3wjA0.jpg;https://images.cdn.europe-west1.gcp.commercetools.com/ff91879f-f4a7-436e-bc45-97970b384e8e/photo_2024-05-24_15--RlxEMgWo.jpg;https://images.cdn.europe-west1.gcp.commercetools.com/ff91879f-f4a7-436e-bc45-97970b384e8e/photo_2024-05-24_15--hCwt9BRg.jpg;,Portoy,armchair-portoy,Portoy,"The ergonomic design provides ample support for your back and neck, while the contoured seat ensures a comfortable sitting experience.",basic;,Orthanc tower plastics,plastic,house
main,1,18,USD 5999,standard,armchairs,This modern metal armchair exudes a sleek and contemporary aesthetic that complements any modern or industrial-style interior.,https://images.cdn.europe-west1.gcp.commercetools.com/ff91879f-f4a7-436e-bc45-97970b384e8e/photo_2024-05-24_19--9OVAfRSA.jpg;https://images.cdn.europe-west1.gcp.commercetools.com/ff91879f-f4a7-436e-bc45-97970b384e8e/photo_2024-05-24_20--fyuzeQdo.jpg;https://images.cdn.europe-west1.gcp.commercetools.com/ff91879f-f4a7-436e-bc45-97970b384e8e/photo_2024-05-24_20--Cnx6bgpE.jpg;,Dana,armchair-dana,Dana,This modern metal armchair exudes a sleek and contemporary aesthetic that complements any modern or industrial-style interior.,basic;,Mordor Forges,metal,house
main,1,19,USD 7999,standard,armchairs,"The seat and backrest, upholstered in soft and supple leather, provide exceptional comfort and support. The leather's rich texture and subtle sheen add a luxurious element, making this armchair a perfect choice for both home and office environments.",https://images.cdn.europe-west1.gcp.commercetools.com/ff91879f-f4a7-436e-bc45-97970b384e8e/photo_2024-05-24_20--BrOKiI_K.jpg;https://images.cdn.europe-west1.gcp.commercetools.com/ff91879f-f4a7-436e-bc45-97970b384e8e/photo_2024-05-24_20--iOkZRELq.jpg;https://images.cdn.europe-west1.gcp.commercetools.com/ff91879f-f4a7-436e-bc45-97970b384e8e/photo_2024-05-24_20--RLqUvDSU.jpg;,Kolt,armchair-kolt,Kolt,"The seat and backrest, upholstered in soft and supple leather, provide exceptional comfort and support. The leather's rich texture and subtle sheen add a luxurious element, making this armchair a perfect choice for both home and office environments.",basic;,Mordor Forges,metal,house
main,1,20,USD 14999,standard,armchairs,"The natural wood grain is beautifully highlighted by a rich, warm finish that enhances the chair's natural beauty. The sturdy construction and robust materials guarantee exceptional durability, ensuring that this armchair will become a cherished piece in your home for years to come.",https://images.cdn.europe-west1.gcp.commercetools.com/ff91879f-f4a7-436e-bc45-97970b384e8e/photo_2024-05-24_15--1cS1JWOP.jpg;https://images.cdn.europe-west1.gcp.commercetools.com/ff91879f-f4a7-436e-bc45-97970b384e8e/photo_2024-05-24_15--FYYWcrH5.jpg;https://images.cdn.europe-west1.gcp.commercetools.com/ff91879f-f4a7-436e-bc45-97970b384e8e/photo_2024-05-24_16--zfB5u76S.jpg;,Poljuko,armchair-poljuko,Poljuko,"The natural wood grain is beautifully highlighted by a rich, warm finish that enhances the chair's natural beauty. The sturdy construction and robust materials guarantee exceptional durability, ensuring that this armchair will become a cherished piece in your home for years to come.",basic;,Fangorn Planks,wooden,house
main,1,21,USD 9900,standard,chairs,"This chair with leather upholstery features a sturdy frame and legs. The seat and backrest are covered in high-quality leather, which may be smooth or textured depending on the design. The leather is stretched taut over a layer of padding to provide comfort and support for the person sitting in the chair.  The chair has a high backrest making it ideal for the dining room or a study room.  Overall, a chair with leather upholstery is typically sleek and modern in design, providing a comfortable and stylish seating option for any room.",https://storage.googleapis.com/merchant-center-europe/sample-data/goodstore/Charcoal_Chair-1.2.jpeg;https://storage.googleapis.com/merchant-center-europe/sample-data/goodstore/Charcoal_Chair-1.1.jpeg;,Charcoal Chair,charcoal-chair,Charcoal Chair,"This chair with leather upholstery features a sturdy frame and legs. The seat and backrest are covered in high-quality leather, which may be smooth or textured depending on the design. The leather is stretched taut over a layer of padding to provide comfort and support for the person sitting in the chair.  The chair has a high backrest making it ideal for the dining room or a study room.  Overall, a chair with leather upholstery is typically sleek and modern in design, providing a comfortable and stylish seating option for any room.",basic;,Fangorn Planks,wooden,house
main,1,22,USD 19900,standard,chairs,"The Rattan Lounge Chair is designed to provide comfortable seating for relaxing and lounging. The chair features a sturdy frame made of rattan, with a woven pattern of rattan fibers forming the seat and backrest.  The chair comes with additional cushioning for extra comfort, made from soft cotton fabric. The cushions are removable, allowing for easy cleaning or replacement.  The design of the rattan lounge chair is inspired by tropical or bohemian styles, with a natural and earthy look. The chair features intricate woven patterns or geometric shapes, creating a visually interesting texture.  The rattan material used in the construction of the chair is known for its durability and resistance to wear and tear. It is also lightweight, making it easy to move the chair around the room.  Overall, a rattan lounge chair is a stylish and comfortable addition to any living room or outdoor space. Its natural materials and unique design create a relaxed and inviting atmosphere, making it the perfect place to unwind and enjoy some peace and quiet.",https://storage.googleapis.com/merchant-center-europe/sample-data/goodstore/Rattan_Lounge_Chair-1.1.jpeg;https://storage.googleapis.com/merchant-center-europe/sample-data/goodstore/Rattan_Lounge_Chair-1.2.jpeg;,Rattan Lounge Chair,rattan-lounge-chair,Rattan Lounge Chair,"The Rattan Lounge Chair is designed to provide comfortable seating for relaxing and lounging. The chair features a sturdy frame made of rattan, with a woven pattern of rattan fibers forming the seat and backrest.  The chair comes with additional cushioning for extra comfort, made from soft cotton fabric. The cushions are removable, allowing for easy cleaning or replacement.  The design of the rattan lounge chair is inspired by tropical or bohemian styles, with a natural and earthy look. The chair features intricate woven patterns or geometric shapes, creating a visually interesting texture.  The rattan material used in the construction of the chair is known for its durability and resistance to wear and tear. It is also lightweight, making it easy to move the chair around the room.  Overall, a rattan lounge chair is a stylish and comfortable addition to any living room or outdoor space. Its natural materials and unique design create a relaxed and inviting atmosphere, making it the perfect place to unwind and enjoy some peace and quiet.",basic;,Fangorn Planks,wooden,house
main,1,23,USD 59900,standard,chairs,"An art deco leather chair with ebony legs has a sleek, streamlined design that exudes sophistication and elegance. The chair has a comfortable padded seat and backrest, with the leather upholstery providing a soft and luxurious feel. The ebony legs are long and tapered, with a smooth finish that accentuates the chair's modern style. The chair also features distinctive art deco elements such as angular shapes, bold lines, and geometric patterns. Overall, this chair would be a striking piece of furniture that adds both style and comfort to any room.",https://storage.googleapis.com/merchant-center-europe/sample-data/goodstore/Fawn_Armchair-1.1.jpeg;,Fawn Armchair,fawn-armchair,Fawn Armchair,"An art deco leather chair with ebony legs has a sleek, streamlined design that exudes sophistication and elegance. The chair has a comfortable padded seat and backrest, with the leather upholstery providing a soft and luxurious feel. The ebony legs are long and tapered, with a smooth finish that accentuates the chair's modern style. The chair also features distinctive art deco elements such as angular shapes, bold lines, and geometric patterns. Overall, this chair would be a striking piece of furniture that adds both style and comfort to any room.",basic;,Mordor Forges,metal,house
main,1,24,USD 7999,standard,chairs,"A modern linen and wood chair features a simple yet stylish design. The chair has a sleek wooden frame, which is stained in a natural wood finish. The seat and backrest are made of a soft linen fabric that is padded for comfort. The linen fabric is a neutral beige.  The backrest of the chair is slightly angled, providing additional comfort and support for the user. The legs of the chair are slightly tapered and have protective foot pads to prevent damage to flooring.  Overall, this modern linen and wood chair is a versatile and elegant addition to any living room, dining room, or office space.",https://storage.googleapis.com/merchant-center-europe/sample-data/goodstore/Bruno_Chair-1.1.jpeg;,Bruno Chair,bruno-chair,Bruno Chair,"A modern linen and wood chair features a simple yet stylish design. The chair has a sleek wooden frame, which is stained in a natural wood finish. The seat and backrest are made of a soft linen fabric that is padded for comfort. The linen fabric is a neutral beige.  The backrest of the chair is slightly angled, providing additional comfort and support for the user. The legs of the chair are slightly tapered and have protective foot pads to prevent damage to flooring.  Overall, this modern linen and wood chair is a versatile and elegant addition to any living room, dining room, or office space.",basic;,Fangorn Planks,wooden,house
